{
  "$schema": "../../../schemas/abstract-test.schema.json",
  "id": "ATS-S5-NAVISWORKS-FEDERATION-INTEGRITY-001",
  "type": "abstract_test",
  "title": "Navisworks Coordination Container Federation Integrity",
  "status": "migration_candidate",
  "system_role": "conformance",
  "modules": ["S5", "S6"],
  "requirement_id": "S5-NAV-SETUP-008",
  "test_intent": "Determine whether a Navisworks coordination container is sufficiently complete, aligned, and traceable for downstream clash execution or formal coordination review.",
  "applicability": {
    "applies_when": "The tested subject is a Navisworks coordination container used for governed clash execution, coordination review, or coordination evidence.",
    "not_applicable_when": "The Navisworks file is an ad-hoc personal review artifact not used for governed coordination."
  },
  "required_evidence": [
    "coordination container identity and declared coordination scope",
    "included source-model list and identifiable source versions",
    "evidence of governed coordinate alignment",
    "reference integrity for appended sources",
    "applicable governed search/selection set definitions",
    "configuration or profile identity sufficient to reproduce the coordination state"
  ],
  "result_logic": {
    "pass": "The required source models and versions are identifiable, references are valid, governed coordinate alignment is confirmed, applicable governed sets are available, and the coordination configuration is reproducible for the declared scope.",
    "fail": "A required source is missing or untraceable, coordinate alignment is invalid, references are broken, required governed sets are absent, or configuration inconsistency makes the coordination result unreliable.",
    "not_applicable": "The subject is not used for governed coordination.",
    "indeterminate": "Available evidence is insufficient to establish federation completeness, coordinate alignment, reference integrity, or configuration consistency."
  },
  "permitted_implementation_classes": ["api_checker", "model_checker", "file_checker", "hybrid", "human_verification"],
  "provenance": {
    "source_system": "repository_curator",
    "derived_from": "TIVERIT-BIM-STD-S5-NAVISWORKS-PROJECT-SETUP-001:S5-NAV-SETUP-008",
    "supporting_confluence_pages": ["8126475", "10944513"],
    "migration_note": "Conformance object derived from the migrated Navisworks setup requirement. Exact software toggles and project tolerances remain outside this abstract test."
  }
}
