{
  "$schema": "../../../schemas/abstract-test.schema.json",
  "id": "ATS-S9-TOOL-AUTHORITY-001",
  "type": "abstract_test",
  "title": "Governed information domains have explicit tool authority",
  "status": "migration_candidate",
  "system_role": "conformance",
  "modules": ["S9"],
  "requirement_id": "REQ-S9-AUTH-001",
  "test_intent": "Determine whether each governed information domain in scope has an explicit authoritative tool or environment assignment with declared lifecycle context, governing references and change authority, rather than relying on implied authority from workflow or tool usage.",
  "applicability": {
    "applies_when": "A governed information domain is created, edited, hosted, transformed or exchanged through one or more tools or environments.",
    "not_applicable_when": "No governed information domain or tool/environment authority decision is in scope."
  },
  "required_evidence": [
    "applicable REG-S9-TOOL-AUTHORITY-001 entry",
    "information-domain scope and lifecycle context",
    "declared authoritative environment and non-authoritative environments",
    "governing references and change-authority role",
    "approved project deviation where organization-level authority is specialized"
  ],
  "result_logic": {
    "pass": "Every applicable governed information domain resolves to one explicit authoritative environment for the stated scope and lifecycle context, with no conflicting authority assignment.",
    "fail": "An applicable governed information domain has no explicit authoritative environment, has conflicting authoritative environments for the same scope/context, or relies only on implied authority from workflow, convenience or technical capability.",
    "not_applicable": "No governed information-domain tool-authority decision applies to the tested scope.",
    "indeterminate": "The domain boundary, lifecycle context, registry entry, or approved project deviation is unavailable or insufficient to establish authority."
  },
  "permitted_implementation_classes": ["registry_checker", "human_verification", "hybrid"],
  "provenance": {
    "source_system": "confluence",
    "derived_from": "REQ-S9-AUTH-001",
    "source_page_id": "4554779",
    "source_title": "Tool Authority Matrix – Governance Scaffold (GAP-S9-02)",
    "migration_note": "Promotes the source validation hook into abstract conformance without inventing any product-specific authority assignment. Empty or incomplete registry coverage remains visible rather than being silently normalized."
  }
}
